<?xml version="1.0" encoding="UTF-8"?>

<sequence id="001"
          name="ID21 FFE dec.2010"
          xmlns:xsi="http://www.w3.org/2001/XMLSchema-instance"
          xsi:noNamespaceSchemaLocation="/users/gerring/Desktop/dad.xsd">

  <userField name="User Name"   value="Michel Strogoff"/>
  <userField name="Sample Name" value="Kryptonite"/>

  <acquisition name="Dark for White" mg="MGfrelon2k"/>
  <acquisition name="Dark for data" mg="MGfrelon2k"/>

  <scan name="scan 001">
    <scanField name="Start Value" value="" />
    <scanField name="End Value" value="" />
    <scanField name="Steps" value="" />

    <acquisition name="MonoPos" mg="MGmono" />
    <acquisition name="White before" mg="MGfrelon2k"/>
    <acquisition name="Data" mg="MGfrelon2k" />
    <acquisition name="White after" mg="MGfrelon2k" />
  </scan>


</sequence>
